{
  "command_id": "cmd-replay-001",
  "body": "mail",
  "action": "MAIL_DISPATCH",
  "adapter": "smtp",
  "parameters": {
    "to": "recipient@example.test",
    "from": "sender@example.test",
    "subject": "Replay Attempt Test",
    "body": "This command must execute once and be refused on replay."
  },
  "authority_seal_id": "seal-replay-001"
}
